{
  "orderId": "500123",
  "erpPONumber": "example_value",
  "versionNumber": 10,
  "orderDate": "example_value",
  "orderMethodCategory": "example_value",
  "currency": "example_value",
  "purchaseOrg": "example_value",
  "purchaseGroup": "example_value",
  "companyCode": "example_value",
  "lineItems": [],
  "requisitionId": "500123",
  "contractId": "500123",
  "comments": "example_value",
  "createdDate": "example_value",
  "lastModifiedDate": "example_value",
  "closedDate": "example_value"
}